{
  "@context": {
    "@vocab": "https://schema.org/",
    "pf": "https://pf-framework.org/ontology/",
    "csuite": "https://pf-framework.org/ontology/csuite/",
    "ops": "https://pf-framework.org/ontology/operations/",
    "gov": "https://pf-framework.org/ontology/governance/",
    "strat": "https://pf-framework.org/ontology/strategy/",
    "ext": "https://pf-framework.org/ontology/extensions/",
    "xsd": "http://www.w3.org/2001/XMLSchema#"
  },
  "@id": "csuite:ChiefOperatingOfficer",
  "@type": ["Role", "csuite:ExecutiveRole"],
  "name": "Chief Operating Officer",
  "alternateName": ["COO", "Chief Operations Officer"],
  "version": "2.0.0",
  "dateCreated": "2025-01-01",
  "description": "Enterprise-scope ontology defining the Chief Operating Officer role with delegated functional strategy accountability for organizational Operations Strategy, reporting to CEO with Board accountability cascade.",
  
  "pf:ontologyMetadata": {
    "@type": "pf:OntologyDefinition",
    "pf:frameworkAlignment": "PF Core Value Engineering",
    "pf:vsomIntegration": true,
    "pf:extensionArchitecture": "Modular",
    "pf:scopeLevel": "Enterprise-Generic",
    "pf:specializationReadiness": ["Sector", "Organization", "Scale", "Maturity", "Portfolio"]
  },

  "csuite:roleDefinition": {
    "@type": "csuite:ExecutiveRoleDefinition",
    "@id": "csuite:COO-RoleDefinition",
    
    "csuite:corePurpose": {
      "@type": "csuite:RolePurpose",
      "description": "Translate organizational strategy into operational excellence through systematic execution, process optimization, and resource orchestration while ensuring sustainable value delivery across all operational domains.",
      "csuite:valueProposition": [
        "Strategy-to-Execution Translation",
        "Operational Excellence Delivery",
        "Cross-Functional Integration",
        "Scalable Systems Architecture",
        "Sustainable Performance Optimization"
      ]
    },

    "csuite:accountabilityChain": {
      "@type": "csuite:GovernanceAccountability",
      "csuite:primaryAccountability": {
        "@type": "csuite:AccountabilityRelationship",
        "csuite:accountableTo": {
          "@type": "csuite:ExecutiveRole",
          "@id": "csuite:ChiefExecutiveOfficer",
          "name": "Chief Executive Officer"
        },
        "csuite:accountabilityType": "Direct-Line",
        "csuite:accountabilityScope": [
          "Operational Performance",
          "Strategy Execution",
          "Resource Utilization",
          "Process Efficiency",
          "Operational Risk Management"
        ]
      },
      "csuite:ultimateAccountability": {
        "@type": "gov:BoardAccountability",
        "csuite:accountableTo": {
          "@type": "Organization",
          "@id": "gov:BoardOfDirectors",
          "name": "Board of Directors"
        },
        "csuite:accountabilityType": "Delegated-via-CEO",
        "csuite:accountabilityScope": [
          "Operational Strategy Alignment",
          "Fiduciary Operational Performance",
          "Risk Governance Compliance",
          "Stakeholder Value Delivery"
        ]
      }
    },

    "csuite:strategyInfluence": {
      "@type": "strat:StrategyInfluenceModel",
      "strat:influenceLevel": "Substantial",
      "strat:influenceScope": [
        {
          "@type": "strat:InfluenceDomain",
          "name": "Overall Organizational Strategy",
          "strat:influenceType": "Advisory-Input",
          "strat:contributionAreas": [
            "Operational Feasibility Assessment",
            "Execution Capacity Evaluation",
            "Resource Requirement Forecasting",
            "Implementation Timeline Estimation",
            "Risk Identification"
          ]
        },
        {
          "@type": "strat:InfluenceDomain",
          "name": "Operations Strategy",
          "strat:influenceType": "Delegated-Accountability",
          "strat:contributionAreas": [
            "Strategy Formulation",
            "Strategy Execution",
            "Performance Management",
            "Continuous Improvement"
          ]
        }
      ]
    }
  },

  "csuite:vsomAlignment": {
    "@type": "pf:VSOMFramework",
    "@id": "pf:COO-VSOM-Alignment",
    "description": "Integration with PF Core Value Engineering VSOM framework",
    
    "pf:visionAlignment": {
      "@type": "pf:VisionComponent",
      "pf:alignmentResponsibility": "Operational Vision Translation",
      "pf:deliverables": [
        "Operational Excellence Vision Statement",
        "Future State Operating Model",
        "Capability Development Roadmap",
        "Technology Enablement Vision"
      ],
      "pf:cascadeDirection": "Top-Down-from-Corporate-Vision"
    },

    "pf:strategyAlignment": {
      "@type": "pf:StrategyComponent",
      "pf:accountabilityLevel": "Delegated-Functional-Strategy",
      "pf:strategyLayers": [
        {
          "@type": "pf:StrategyLayer",
          "name": "Operations Strategy",
          "pf:accountabilityType": "Primary-Ownership",
          "pf:scope": "Full-Lifecycle"
        },
        {
          "@type": "pf:StrategyLayer",
          "name": "Corporate Strategy",
          "pf:accountabilityType": "Contribution-Input",
          "pf:scope": "Operational-Feasibility-Validation"
        }
      ]
    },

    "pf:objectivesAlignment": {
      "@type": "pf:ObjectivesComponent",
      "pf:objectiveCategories": [
        {
          "@type": "pf:ObjectiveCategory",
          "name": "Operational Excellence Objectives",
          "pf:ownership": "Primary",
          "pf:examples": [
            "Process Efficiency Targets",
            "Quality Standards Achievement",
            "Cost Optimization Goals",
            "Delivery Performance Targets"
          ]
        },
        {
          "@type": "pf:ObjectiveCategory",
          "name": "Strategic Enablement Objectives",
          "pf:ownership": "Shared-with-CSuite",
          "pf:examples": [
            "Capability Development Milestones",
            "Technology Adoption Targets",
            "Scalability Readiness Goals",
            "Innovation Implementation Objectives"
          ]
        }
      ]
    },

    "pf:metricsAlignment": {
      "@type": "pf:MetricsComponent",
      "pf:metricsFramework": {
        "@type": "pf:MetricsArchitecture",
        "pf:primaryMetricsDomains": [
          {
            "@type": "pf:MetricsDomain",
            "name": "Operational Performance Metrics",
            "pf:metricTypes": [
              "Efficiency Ratios",
              "Productivity Indicators",
              "Quality Scores",
              "Cycle Time Measures",
              "Throughput Metrics"
            ]
          },
          {
            "@type": "pf:MetricsDomain",
            "name": "Financial Performance Metrics",
            "pf:metricTypes": [
              "Cost Performance",
              "Budget Variance",
              "ROI on Operations Investments",
              "Unit Economics"
            ]
          },
          {
            "@type": "pf:MetricsDomain",
            "name": "Strategic Performance Metrics",
            "pf:metricTypes": [
              "Strategy Execution Progress",
              "Capability Maturity Scores",
              "Transformation Milestone Achievement",
              "Innovation Pipeline Health"
            ]
          },
          {
            "@type": "pf:MetricsDomain",
            "name": "Stakeholder Performance Metrics",
            "pf:metricTypes": [
              "Customer Satisfaction (Operations-Related)",
              "Employee Engagement (Operations Functions)",
              "Partner/Supplier Performance",
              "Regulatory Compliance Scores"
            ]
          }
        ]
      }
    }
  },

  "ops:functionalDomains": {
    "@type": "ops:OperationalDomainArchitecture",
    "@id": "ops:COO-FunctionalDomains",
    "description": "Enterprise-scope functional domains under COO accountability",

    "ops:coreFunctionalDomains": [
      {
        "@type": "ops:FunctionalDomain",
        "@id": "ops:OperationsManagement",
        "name": "Operations Management",
        "description": "Core operational execution and day-to-day management",
        "ops:subDomains": [
          {
            "@type": "ops:SubDomain",
            "name": "Production/Service Delivery Operations",
            "ops:scopeElements": [
              "Production Planning",
              "Capacity Management",
              "Service Delivery Execution",
              "Quality Assurance",
              "Performance Monitoring"
            ]
          },
          {
            "@type": "ops:SubDomain",
            "name": "Process Management",
            "ops:scopeElements": [
              "Process Design",
              "Process Optimization",
              "Process Automation",
              "Continuous Improvement Programs",
              "Lean/Six Sigma Initiatives"
            ]
          },
          {
            "@type": "ops:SubDomain",
            "name": "Resource Management",
            "ops:scopeElements": [
              "Resource Allocation",
              "Capacity Planning",
              "Asset Utilization",
              "Workforce Planning (Operations)",
              "Equipment/Infrastructure Management"
            ]
          }
        ],
        "ops:accountabilityLevel": "Primary"
      },
      {
        "@type": "ops:FunctionalDomain",
        "@id": "ops:SupplyChainManagement",
        "name": "Supply Chain Management",
        "description": "End-to-end supply chain oversight and optimization",
        "ops:subDomains": [
          {
            "@type": "ops:SubDomain",
            "name": "Procurement & Sourcing",
            "ops:scopeElements": [
              "Vendor Selection",
              "Contract Management",
              "Spend Management",
              "Supplier Relationship Management",
              "Strategic Sourcing"
            ]
          },